technique,summary,success,error,latency,summary_length,rouge1_precision,rouge1_recall,rouge1_f1,rouge2_precision,rouge2_recall,rouge2_f1,rougeL_precision,rougeL_recall,rougeL_f1,news_id,sentences_count,original_length
Enhanced (Full),"Ações incluem doação inicial de R$ 200 mil via Fundação BB, flexibilização de crédito e renegociação de dívidas para pessoas físicas, empresas e produtores rurais, além de apoio aos municípios atingidos ! Banco do Brasil anuncia medidas de apoio às vítimas das enchentes na Zona da Mata mineira O Banco do Brasil acionou o protocolo do Programa Ajuda Humanitária e lançou campanha de apoio às pessoas atingidas pelas fortes chuvas na região da Zona da Mata, em Minas Gerais.",True,,0.03530621528625488,474,0.6521739130434783,0.7142857142857143,0.6818181818181819,0.5164835164835165,0.5662650602409639,0.5402298850574714,0.42391304347826086,0.4642857142857143,0.44318181818181823,doc_17_26,3,5301
Enhanced (Full),"A participação da sociedade é fundamental para avançar nos debates e estratégias de enfrentamento da prática discriminatória, destaca a ministra da Igualdade Racial, Anielle Franco. “Esse comitê amplia a participação de povos, comunidades tradicionais e grupos historicamente vulnerabilizados nos debates sobre o racismo ambiental e esse é um avanço muito importante. O problema é coletivo e as soluções também precisam ser.",True,,0.027491331100463867,424,0.4626865671641791,0.5081967213114754,0.484375,0.19696969696969696,0.21666666666666667,0.20634920634920634,0.29850746268656714,0.32786885245901637,0.3125,doc_15_16_syn_extract_middle_3677,3,675
Enhanced (Full),"Representando a B3, o vice-presidente de produtos e clientes, Luiz Masagão, enfatizou a importância da educação financeira para a vida prática e para o desenvolvimento do País. “A educação financeira é essencial para qualquer carreira e para a vida cotidiana. Ela transforma conceitos em algo aplicável, ajudando as pessoas a tomar decisões melhores.",True,,0.0268099308013916,350,0.7704918032786885,0.6619718309859155,0.712121212121212,0.6,0.5142857142857142,0.5538461538461538,0.7049180327868853,0.6056338028169014,0.6515151515151515,doc_11_25_syn_extract_middle_1096,3,446
Enhanced (Full),"O conceito do Programa foi elevado pela segunda vez consecutiva e se refere à Avaliação Quadrienal 2021-2024 ! 2025-09-10_Escola de Governo_Pós_DeividOliveira (7) v2.JPG O **Programa de Pós-Graduação em Ciência e Tecnologia das Radiações, Minerais e Materiais (PPG-CDTN)** conquistou **nota 6** na Avaliação Quadrienal 2021-2024 da Coordenação de Aperfeiçoamento de Pessoal de Nível Superior (Capes).",True,,0.02999114990234375,400,0.5694444444444444,0.41414141414141414,0.47953216374269003,0.4225352112676056,0.30612244897959184,0.35502958579881655,0.4722222222222222,0.3434343434343434,0.39766081871345027,doc_11_08_syn_short_6574,3,1413
Enhanced (Full),"Presidente em exercício reforça que o mais urgente é socorro às vítimas e anuncia recursos de R$ 800 por pessoa desabrigada, a serem destinados às prefeituras ! Nesta terça-feira, 24 de fevereiro, o presidente da República em exercício e ministro do Desenvolvimento, Indústria, Comércio e Serviços (MDIC), Geraldo Alckmin, fez um balanço das ações do Governo do Brasil na Zona da Mata Mineira, especialmente nas cidades de Juiz de Fora e Ubá, principais atingidas pelas fortes chuvas das últimas horas. A primeira tarefa é a Defesa, as Forças Armadas, a logística, tropa, viatura, apoio ao Corpo de Bombeiros, à Saúde e à equipe da Força Nacional do SUS.",True,,0.035391807556152344,654,0.4117647058823529,0.5104166666666666,0.45581395348837206,0.2033898305084746,0.25263157894736843,0.22535211267605637,0.29411764705882354,0.3645833333333333,0.3255813953488372,doc_19_08,3,4007
Enhanced (Full),"Evento em Brasília reúne autoridades da América Latina e do Caribe para discutir políticas de combate à fome e fortalecimento da agricultura familiar ! WhatsApp Image 2026-03-03 at 12.01.47 (1).jpeg A presidente do Fundo Nacional de Desenvolvimento da Educação (FNDE), Fernanda Pacobahyba, participou, na segunda-feira (2/3), do início das atividades da 39ª Conferência Regional da Organização das Nações Unidas para a Alimentação e a Agricultura (FAO) para a América Latina e o Caribe.",True,,0.029419660568237305,486,0.5280898876404494,0.5595238095238095,0.5433526011560693,0.2840909090909091,0.30120481927710846,0.2923976608187135,0.3595505617977528,0.38095238095238093,0.3699421965317919,doc_17_29_syn_short_3938,3,3028
Enhanced (Full),"Proposta introduz contabilização dupla e modelo híbrido para reduzir encargos e alinhar operação à realidade do sistema. O Ministério de Minas e Energia (MME) abriu, nesta segunda-feira (02/03), uma consulta pública para discutir diretrizes de modernização do mercado de energia elétrica brasileiro. A proposta estabelece a implementação da contabilização dupla no Mercado de Curto Prazo e a transição para um modelo híbrido de formação de preços, que passa a incorporar ofertas de quantidade de energia.",True,,0.031278133392333984,504,0.7191011235955056,0.6213592233009708,0.6666666666666666,0.5454545454545454,0.47058823529411764,0.5052631578947367,0.5730337078651685,0.49514563106796117,0.5312499999999999,doc_09_07,3,3207
Enhanced (Full),"Estado define delegados e propostas para evento nacional, marcado para maço em Aracruz (ES) ! Cópia de carrossel - 2026-02-03T131203.030 (1).png",True,,0.02754998207092285,144,0.48,0.16666666666666666,0.24742268041237112,0.25,0.08450704225352113,0.12631578947368421,0.44,0.1527777777777778,0.22680412371134018,doc_07_02_syn_extract_first_4111,3,408
Enhanced (Full),"SITE 2026 (6).png O Conselho Administrativo de Defesa Econômica (Cade) abriu processo seletivo para contratação de consultoria técnica para a elaboração do **Guia de Abuso de Poder Econômico** da autarquia. A iniciativa visa consolidar orientações técnicas, jurídicas e econômicas sobre condutas unilaterais e abuso de posição dominante, fortalecendo a atuação institucional do Cade e a promoção da cultura da concorrência.",True,,0.027644872665405273,423,0.8378378378378378,0.6888888888888889,0.7560975609756098,0.7397260273972602,0.6067415730337079,0.6666666666666666,0.7837837837837838,0.6444444444444445,0.7073170731707318,doc_09_02,3,2018
Enhanced (Full),"Memorando assinado na China prevê uso de capacidade produtiva internacional, intercâmbio técnico e pode elevar escala de fabricação de imunizantes brasileiros !",True,,0.028946638107299805,160,0.9166666666666666,0.3188405797101449,0.47311827956989244,0.7391304347826086,0.25,0.37362637362637363,0.875,0.30434782608695654,0.4516129032258065,doc_09_42_syn_extract_first_1158,3,395
Enhanced (Full),"Ação conjunta levará a mensagem ""Se liga, ou eu ligo 180"" para postos rodoviários em todas as capitais do país ! Em uma ação preventiva e de conscientização para o período do Carnaval em todo o território nacional, o Ministério das Mulheres e a Polícia Rodoviária Federal (PRF) firmaram uma parceria para ampliar o alcance da campanha de combate à violência contra a mulher durante o período festivo. A iniciativa visa lembrar a população sobre a importância de denunciar qualquer forma de agressão, assédio ou importunação sexual, utilizando o Ligue 180 - Central de Atendimento à Mulher.",True,,0.02664780616760254,589,0.6909090909090909,0.76,0.7238095238095238,0.5321100917431193,0.5858585858585859,0.5576923076923076,0.5181818181818182,0.57,0.5428571428571428,doc_17_20_syn_short_4180,3,1412
Enhanced (Full),"Pensado para contribuir com ações de educação patrimonial, o Atlas apresenta de forma acessível o trabalho baseado em relatórios dos acervos do Iphan e em dados coletados em visitas de campo a sítios arqueológicos. São mais de 150 páginas de fotos, tabelas, referências e muitos dados que estavam dispersos em repositórios nacionais e internacionais.",True,,0.026557445526123047,350,0.703125,0.5421686746987951,0.6122448979591836,0.38095238095238093,0.2926829268292683,0.33103448275862063,0.421875,0.3253012048192771,0.36734693877551017,doc_07_16_syn_extract_middle_4139,3,350
Enhanced (Full),"Implantação BR-020BA_BR-020 BA - 76 por cento-01.jpg Melhoria na trafegabilidade, conforto e segurança para os usuários são os principais objetivos das obras de implantação da BR-020/BA, no trecho que liga o município de Campo Alegre de Lourdes a São Raimundo Nonato, na divisa com o Piauí. São 11,8 quilômetros de rodovia sendo pavimentados, concluindo o último trecho não pavimentado deste segmento.",True,,0.02916550636291504,401,0.5256410256410257,0.5694444444444444,0.5466666666666666,0.2727272727272727,0.29577464788732394,0.28378378378378377,0.32051282051282054,0.3472222222222222,0.3333333333333333,doc_13_02_syn_short_8749,3,1965
Baseline TextRank,Participação das redes é voluntária e ocorre em duas etapas. Interessados têm até sexta-feira (13) para se inscrever no programa que oferece apoio financeiro para o fortalecimento da matemática nas escolas ! [Toda Matemática 1.png](https://www.gov.br/mec/pt-br/assuntos/noticias/2026/marco/ultimos-dias-para-aderir-ao-compromisso-nacional-toda-matematica/toda-matematica-1.png/@@images/4868ebaa-40db-4765-9fbf-01d7fd41257e.png),True,,0.026076555252075195,427,0.38028169014084506,0.38571428571428573,0.3829787234042553,0.22857142857142856,0.2318840579710145,0.2302158273381295,0.19718309859154928,0.2,0.19858156028368795,doc_11_39_syn_extract_first_6344,4,426
Baseline TextRank,"** Foi assim que o ano de 2025 terminou, com um **aumento de 3,4%** no conjunto de participantes em relação ao final de 2024, totalizando **92.818**. Destaque para os números do setor de **consultores de valores mobiliários**, o qual teve a maior taxa de **crescimento no ano: 27,3%**, um total de 2.635 participantes registrados. O mercado regulado fecha 2025 com 7 administradoras de mercado organizado registradas na Autarquia, indicando um aumento de competitividade no setor. ***""Esse Boletim Econômico, que consolida os números de 2025, mostra um mercado de capitais que segue em expansão estrutural, com maior diversidade de instrumentos financeiros, volume e ampliação dos mercados regulados, com destaque para o mercado de dívida, e o avanço expressivo no registro de consultores, que impacta diretamente a cadeia de distribuição de valores mobiliários.",True,,0.02535843849182129,862,0.38620689655172413,0.875,0.5358851674641149,0.2152777777777778,0.49206349206349204,0.29951690821256044,0.2206896551724138,0.5,0.3062200956937799,doc_09_01_syn_short_9779,4,1091
Baseline TextRank,"O MinC reforça a recomendação para que todos os candidatos consultem antecipadamente sua regularidade jurídica, fiscal e tributária. Estar em débito com a União impede o recebimento de recursos públicos. É fundamental resolver eventuais pendências nos seguintes sistemas: • Cadastro Informativo de Créditos Não Quitados do Setor Público Federal (Cadin); • Certidão Negativa de Débitos Relativos a Créditos Tributários Federais e Dívida Ativa da União (CND); • Certificado de Regularidade do FGTS; • Consulta de Transferência (Constransf); • Sistema de Apoio às Leis de Incentivo à Cultura (Salic); • Cadastro de Entidades Privadas Sem Fins Lucrativos Impedidas (Cepim); • Cadastro Nacional de Empresas Inidôneas e Suspensas (Ceis); • Sistema de Cadastramento Unificado de Fornecedores (Sicaf).",True,,0.027803421020507812,793,0.3951612903225806,0.765625,0.5212765957446809,0.21138211382113822,0.4126984126984127,0.27956989247311825,0.33064516129032256,0.640625,0.43617021276595747,doc_07_12_syn_extract_middle_7735,4,809
Baseline TextRank,"“O Instituto Butantan nasceu da necessidade de proteger a população. Hoje, com os investimentos do governo do presidente Lula, ele se projeta para o futuro como um dos pilares da produção nacional de vacinas e da segurança sanitária do país”, disse o vice-presidente.",True,,0.026201725006103516,267,0.7551020408163265,0.8409090909090909,0.7956989247311828,0.6666666666666666,0.7441860465116279,0.7032967032967034,0.6938775510204082,0.7727272727272727,0.7311827956989247,doc_17_14_syn_extract_middle_5272,4,267
Baseline TextRank,"A ferramenta busca orientar as pessoas sobre as medidas de proteção a serem tomadas. Dessa forma, os alertas terão informações sobre o tipo de risco que está prestes a acontecer e instruções práticas. As definições de conteúdo e do momento de envio dos alertas são de responsabilidade dos órgãos de proteção e defesa civil locais e a ação é operacionalizada por meio da Interface de Divulgação de Alertas Públicos (Idap).",True,,0.02611684799194336,421,0.7195121951219512,0.7468354430379747,0.732919254658385,0.5308641975308642,0.5512820512820513,0.5408805031446542,0.5853658536585366,0.6075949367088608,0.5962732919254657,doc_19_05_syn_extract_middle_6325,4,421
Baseline TextRank,"A operação contou com a colaboração da ABIN, para aprofundar a compreensão sobre a ameaça representada por armas produzidas por meio de impressoras 3D, especialmente no contexto de grupos extremistas violentos, bem como para identificar os brasileiros envolvidos no desenvolvimento, financiamento e promoção da arma conhecida como Urutau. A Urutau é arma híbrida de funcionamento semiautomático ou automático que representou avanço significativo sobre projetos anteriores de armas 3D, eliminando a necessidade de soldagem e utilizando apenas componentes não controlados. Cumprindo sua missão institucional de identificar e avaliar riscos e ameaças à segurança do Estado e da sociedade, o assessoramento prestado pela ABIN analisou os avanços técnicos, a ideologia subjacente, o interesse de extremistas e criminosos por armas 3D, casos de uso e apreensões no Brasil e no exterior, além de alertar sobre o projeto da Urutau, seus desenvolvedores e desafios e iniciativas de fiscalização e controle. A atuação integrada de análise, coleta e cruzamento de informações permitiu não apenas compreender melhor o fenômeno investigado, mas também identificar indivíduos envolvidos e subsidiar a adoção de medidas preventivas, de obstrução e neutralização de ameaças em curso.",True,,0.029448509216308594,1267,0.36018957345971564,0.926829268292683,0.5187713310580205,0.2714285714285714,0.7037037037037037,0.3917525773195876,0.33649289099526064,0.8658536585365854,0.4846416382252559,doc_19_38,4,1958
Baseline TextRank,"O evento, que contou com a participação de representantes de 18 entidades nacionais, estaduais e internacionais de 12 estados da federação, avançou significativamente na identificação de formas de executar sete das principais ações do PAN que estavam com baixa implementação. Entre os resultados alcançados estão a identificação de formas para alcançar os objetivos previstos no PAN; a definição de planos operacionais para execução dessas estratégias em âmbito estadual; e a criação e consolidação de uma rede de colaboração entre as OEMAs participantes.",True,,0.025586843490600586,555,0.7142857142857143,0.6730769230769231,0.6930693069306932,0.4639175257731959,0.4368932038834951,0.45,0.5816326530612245,0.5480769230769231,0.5643564356435645,doc_15_07_syn_extract_middle_7046,4,557
Baseline TextRank,"Com foco em teranósticos, o público-alvo da competição são os estudantes de pós-graduação, e contará com doutoranda do CDTN/CNEN no comitê organizador. Estão abertas as inscrições para as **Olímpiadas Nucleares da América Latina - Hackapower LATAM 2026**, competição acadêmica internacional que tem como objetivo estimular a inovação, o desenvolvimento de habilidades de gestão em projetos complexos e o fortalecimento de redes de colaboração no setor nuclear. A iniciativa também busca promover e divulgar a ciência e a tecnologia em alinhamento com os Objetivos de Desenvolvimento Sustentável (ODS) da **[Organização das Nações Unidas (ONU)](https://news.un.org/pt/)**. O tema central da edição de 2026 será o ***radioteranóstico***, abordagem da medicina nuclear que integra diagnóstico e terapia por meio de radiofármacos direcionados ao mesmo alvo biológico, permitindo identificar, tratar e monitorar doenças de forma de forma personalizada.",True,,0.029219388961791992,947,0.5696969696969697,0.7768595041322314,0.6573426573426573,0.4146341463414634,0.5666666666666667,0.47887323943661975,0.4484848484848485,0.6115702479338843,0.5174825174825175,doc_11_13_syn_short_1964,4,1445
Baseline TextRank,"Novo conteúdo no aplicativo transforma a norma internacional de saúde e segurança em aprendizado prático, acessível e gratuito ! [Card SST Fácil Portal (2).png](https://www.gov.br/fundacentro/pt-br/comunicacao/noticias/noticias/2025/dezembro/sst-facil-aproxima-a-iso-45001-do-dia-a-dia-do-trabalho/card-sst-facil-portal-2.png/@@images/5a6ebf7e-06fb-446c-8f95-81cb24b53452.png)",True,,0.025287151336669922,376,0.4925373134328358,0.5238095238095238,0.5076923076923077,0.36363636363636365,0.3870967741935484,0.37500000000000006,0.3880597014925373,0.4126984126984127,0.4,doc_17_07_syn_extract_first_1009,4,375
Baseline TextRank,Voo inaugural marca fase de testes e validações técnicas; Ministério vem preparando sistema aéreo brasileiro para inclusão da nova tecnologia ! [Embraer faz primeiro voo de aeronave elétrica de decolagem e pouso vertical ](https://www.gov.br/portos-e-aeroportos/pt-br/assuntos/noticias/2025/12/embraer-faz-primeiro-voo-de-aeronave-eletrica-de-decolagem-e-pouso-vertical/embraer-faz-primeiro-voo-de-aeronave-eletrica-de-decolagem-e-pouso-vertical/@@images/56c7b490-05f3-4fb5-97cd-7d031df2af41.png),True,,0.02618098258972168,496,0.4024390243902439,0.532258064516129,0.4583333333333333,0.2962962962962963,0.39344262295081966,0.3380281690140845,0.18292682926829268,0.24193548387096775,0.20833333333333334,doc_05_06_syn_extract_first_1525,4,495
Baseline TextRank,! [Foto_Diogo_Zacarias.png](https://www.gov.br/funai/pt-br/assuntos/noticias/2025/plano-clima-e-aprovado-e-contempla-acoes-destinadas-aos-povos-indigenas-apos-participacao-coletiva-com-apoio-da-funai/foto_diogo_zacarias.png/@@images/3d01c788-7ced-442b-8048-502ada8bb3f3.png),True,,0.028678178787231445,274,0.3023255813953488,0.12745098039215685,0.17931034482758618,0.11904761904761904,0.04950495049504951,0.06993006993006992,0.2558139534883721,0.10784313725490197,0.15172413793103448,doc_15_10_syn_extract_first_7797,4,273
Baseline TextRank,"Iniciativa do Governo do Brasil promove o diálogo entre professores, mestres e jovens na construção de uma educação antirracista ! [12122025caminhosamefricanosangolafotomateria.jpg](https://www.gov.br/igualdaderacial/pt-br/assuntos/copy2_of_noticias/comeca-a-edicao-angola-do-programa-caminhos-amefricanos/12122025caminhosamefricanosangolafotomateria.jpg/@@images/80564fe6-b29c-48f5-bc54-4b06f46fa9f4.jpeg)",True,,0.026402711868286133,406,0.46153846153846156,0.3380281690140845,0.39024390243902435,0.29411764705882354,0.21428571428571427,0.24793388429752067,0.36538461538461536,0.2676056338028169,0.3089430894308943,doc_11_03_syn_extract_first_5853,4,405
Baseline TextRank,"Mais de 2,4 mil serviços foram contratados pela plataforma, que conecta cerca de 8,1 mil microempreendedores individuais a 1,3 mil órgãos públicos ! [Contrata+_1-Ano.png](https://www.gov.br/gestao/pt-br/assuntos/noticias/2026/fevereiro/contrata-brasil-gerou-mais-de-r-13-7-milhoes-de-renda-para-meis-em-um-ano/contrata-_1-ano.png/@@images/2df2f1bb-9941-4aaf-8d03-063963c1a45e.png) Em um ano de operação, a plataforma Contrata+Brasil já gerou R$ 13,7 milhões em renda direta para microempreendedores individuais (MEIs) por meio de contratações realizadas por órgãos públicos em todo o país. Desde o lançamento, em fevereiro do ano passado, 8.129 MEIs se cadastraram na plataforma, que também reúne 1.311 órgãos públicos entre prefeituras, governos estaduais, órgãos federais e suas entidades.",True,,0.029463529586791992,791,0.40816326530612246,0.6818181818181818,0.5106382978723404,0.2945205479452055,0.4942528735632184,0.36909871244635195,0.24489795918367346,0.4090909090909091,0.30638297872340425,doc_01_17_syn_short_4502,4,1004
Baseline TextRank,"Cientistas de cinco países e especialistas indígenas apresentaram nesta quinta-feira (27)  materiais que unem conhecimentos biológicos, indígenas e pesquisa social produzidos a partir de expedição científica realizada no extremo oeste do Amazonas. O evento de lançamento do livro **“Relatório do Inventário Rápido Biológico e Social do Alto Rio Içá #33”** e vídeo acontece às 9h, no Auditório da Ciência do Instituto Nacional de Pesquisas da Amazônia (Inpa/MCTI), com entrada gratuita. O inventário em campo no Alto Rio Içá foi realizado durante 25 dias, em maio de 2025. A região remota com paisagens pouco documentadas da Amazônia Ocidental agora conta com importantes materiais que trazem a caracterização da área estudada, informações sobre a geologia, flora e vegetação e catalogação de quatro grupos de animais (peixes, anfíbios e répteis, aves, mamíferos).",True,,0.029559850692749023,863,0.46794871794871795,0.9012345679012346,0.6160337552742616,0.36129032258064514,0.7,0.47659574468085103,0.358974358974359,0.691358024691358,0.4725738396624472,doc_15_22_syn_short_8939,4,1088
Baseline TextRank,"Parceria garante novas edições do concurso até 2028 e aproxima pesquisa, setor produtivo e políticas públicas para o desenvolvimento florestal sustentável ! [CNI ACT.png](https://www.gov.br/florestal/pt-br/assuntos/noticias/2025/dezembro/sfb-e-cni-fortalecem-cooperacao-para-premio-em-estudos-de-economia-e-mercado-florestal/cni-act.png/@@images/8459a8f9-7b04-4cc8-a908-b39a43554e96.png)",True,,0.026961565017700195,387,0.5396825396825397,0.5666666666666667,0.5528455284552845,0.3709677419354839,0.3898305084745763,0.3801652892561984,0.3333333333333333,0.35,0.3414634146341463,doc_15_03_syn_extract_first_7291,4,386
Baseline TextRank,"A Autoridade Nacional de Segurança Nuclear (ANSN) co-organizou, em parceria com o Escritório de Assuntos Legais da Agência Internacional de Energia Atômica (AIEA), o Workshop Nacional sobre a Convenção de Compensação Suplementar por Dano Nuclear (CSC), realizado no Hotel Windsor Brasília, entre os dias 9 e 12 de dezembro. O evento reuniu representantes de instituições estratégicas do setor nuclear brasileiro para uma discussão aprofundada sobre o regime global de responsabilidade civil por danos nucleares e seus potenciais impactos para o País. Entre os temas abordados, destacaram-se: o arcabouço jurídico brasileiro sobre responsabilidade civil por dano nuclear; o regime global de compensação e suas interfaces com a CSC; requisitos e vantagens do instrumento; montantes indenizatórios; seguro de riscos nucleares; e experiências internacionais de implementação, com cases de Canadá, México, Reino Unido e Estados Unidos. A realização do Workshop Nacional sobre a CSC consolida um marco importante para o debate brasileiro sobre responsabilidade civil nuclear, reforçando o compromisso da ANSN com a modernização regulatória, a articulação entre instituições estratégicas e o alinhamento às melhores práticas internacionais, pilares fundamentais para o desenvolvimento seguro e responsável do setor nuclear no Brasil.",True,,0.03218483924865723,1326,0.4675925925925926,0.7952755905511811,0.5889212827988338,0.2837209302325581,0.48412698412698413,0.3577712609970674,0.35648148148148145,0.6062992125984252,0.44897959183673475,doc_05_01,4,4756
Baseline TextRank,"Ação marca início da distribuição dos mil ônibus da 2ª etapa do Novo PAC Seleções, que beneficiarão até 120 mil estudantes de áreas rurais e de difícil acesso em todo o país, com investimentos de R$ 500 milhões ! [1](https://www.gov.br/fnde/pt-br/assuntos/noticias/governo-do-brasil-entrega-324-onibus-escolares-do-caminho-da-escola/1/@@images/16206f11-1d29-4f2b-8eb2-e50800f28a06.jpeg)",True,,0.026691436767578125,386,0.56,0.6363636363636364,0.5957446808510639,0.40540540540540543,0.46153846153846156,0.43165467625899284,0.48,0.5454545454545454,0.5106382978723404,doc_13_48_syn_extract_first_9698,4,385
Baseline TextRank,"Com um volume de inscrições 3,5 vezes maior que o da edição de 2025, o prazo para avaliação da Comissão Julgadora do 3º Concurso de Fotos e Vídeos da Anatel, que se encerraria na última sexta-feira, foi estendido para 26 de fevereiro. Sob a temática *“Mundo Digital: o futuro é de todos”*, 70% das inscrições se concentraram na categoria Fotos, 20% em Foto feita por pessoa com 60 anos oumais e 10% em Vídeos. A gerente substituta de Interações Institucionais, Satisfação e Educação para o Consumo da Anatel, Carla Badauy, tem a expectativa de que as fotos selecionadas pela Comissão Julgadora sejam as que melhor expressem o tema do concurso, “que permitiu a todos os participantes revelarem não apenas um momento, mas a forma como a tecnologia atravessa a vida das pessoas, conectando afetos, ampliando vozes e criando sentidos”. Na categoria Fotos, R$ 4.500,00 para o 1º colocado, R$ 2.500,00 para o 2º e R$ 1.500,00 para o 3º.",True,,0.03343367576599121,930,0.35195530726256985,0.6363636363636364,0.45323741007194246,0.1404494382022472,0.25510204081632654,0.18115942028985507,0.19553072625698323,0.35353535353535354,0.2517985611510791,doc_07_06,4,2484
